{
    "candidate_id":  "LC-20260810-3f74ede4",
    "schema_version":  "1.0.0",
    "created_at":  "2026-08-10T13:08:46+08:00",
    "collector_version":  "1.0.0",
    "governance_version":  "1.4.0",
    "governance_hash":  "759F5EE67C5706DD7BF9B193913DFA6B6EEF03292FC0B8FA264F40A9A9E146D2",
    "source_task_ids":  [
                            "telegram-telegram-1449022024-1189-20260703-185037-401113",
                            "telegram-telegram-1449022024-1273-20260710-190809-316973"
                        ],
    "source_evidence_paths":  [
                                  "E:\\AgentOS\\data\\escalations\\telegram-telegram-1449022024-1189-20260703-185037-401113\\RESOLUTION.json",
                                  "E:\\AgentOS\\data\\escalations\\telegram-telegram-1449022024-1273-20260710-190809-316973\\RESOLUTION.json"
                              ],
    "failure_reason_key":  "invalid_or_missing_verify_verdict",
    "failure_reason_examples":  [
                                    "invalid_or_missing_verify_verdict"
                                ],
    "frequency":  2,
    "threshold":  2,
    "retry_evidence":  [

                       ],
    "resolved_evidence":  [
                              {
                                  "resolved_at":  "2026-07-04T22:41:19.7308230+08:00",
                                  "task_id":  "telegram-telegram-1449022024-1189-20260703-185037-401113",
                                  "resolution_path":  "E:\\AgentOS\\data\\escalations\\telegram-telegram-1449022024-1189-20260703-185037-401113\\RESOLUTION.json",
                                  "reason":  "invalid_or_missing_verify_verdict"
                              },
                              {
                                  "resolved_at":  "2026-08-10T10:34:15.7034240+08:00",
                                  "task_id":  "telegram-telegram-1449022024-1273-20260710-190809-316973",
                                  "resolution_path":  "E:\\AgentOS\\data\\escalations\\telegram-telegram-1449022024-1273-20260710-190809-316973\\RESOLUTION.json",
                                  "reason":  "invalid_or_missing_verify_verdict"
                              }
                          ],
    "impact":  "low",
    "recommendation":  "分析重複出現的失敗原因（invalid_or_missing_verify_verdict），評估是否需要更新工作流程步驟、驗收條件或相關腳本。",
    "change_class":  "implementation_change",
    "josh_approval_status":  "pending",
    "dedupe_key":  "3f74ede43775d9517b9fcc853d0134d35a11a284a33358e1a7c3a61aa19414e7",
    "status":  "open"
}
