{
    "candidate_id":  "LC-20260729-4505e58a",
    "schema_version":  "1.0.0",
    "created_at":  "2026-07-29T16:42:59+08:00",
    "collector_version":  "1.0.0",
    "governance_version":  "1.3.0",
    "governance_hash":  "0EAECF6D153925AC17B940992CC12CE82A6DE5E7F1D7B766BAB9C479C3088EB1",
    "source_task_ids":  [
                            "2026-07-03-workflow-v1-2-dedupe-fixture",
                            "2026-07-26-docs-governance-status-autolink",
                            "2026-07-26-operational-drift-triage",
                            "2026-07-26-queue-active-index-optimization",
                            "2026-07-29-hermes-runtime-config-decoupling-build",
                            "knowledge-workspace-phase1-readonly-20260720",
                            "telegram-telegram-1449022024-1189-20260703-185037-401113"
                        ],
    "source_evidence_paths":  [
                                  "E:\\AgentOS\\data\\metrics\\METRICS_LOG.jsonl"
                              ],
    "failure_reason_key":  "unknown_retry",
    "failure_reason_examples":  [
                                    "unknown_retry"
                                ],
    "frequency":  7,
    "threshold":  2,
    "retry_evidence":  [
                           {
                               "recorded_at":  "2026-07-03T17:18:17.3172143+08:00",
                               "retry_count":  1,
                               "task_id":  "2026-07-03-workflow-v1-2-dedupe-fixture",
                               "fail_reason":  "unknown_retry"
                           },
                           {
                               "recorded_at":  "2026-07-04T23:10:00.0000000+08:00",
                               "retry_count":  1,
                               "task_id":  "telegram-telegram-1449022024-1189-20260703-185037-401113",
                               "fail_reason":  "unknown_retry"
                           },
                           {
                               "recorded_at":  "2026-07-20T18:36:06.2783317+08:00",
                               "retry_count":  4,
                               "task_id":  "knowledge-workspace-phase1-readonly-20260720",
                               "fail_reason":  "unknown_retry"
                           },
                           {
                               "recorded_at":  "2026-07-26T22:10:20.6535183+08:00",
                               "retry_count":  2,
                               "task_id":  "2026-07-26-operational-drift-triage",
                               "fail_reason":  "unknown_retry"
                           },
                           {
                               "recorded_at":  "2026-07-27T17:29:44.0768192+08:00",
                               "retry_count":  1,
                               "task_id":  "2026-07-26-docs-governance-status-autolink",
                               "fail_reason":  "unknown_retry"
                           },
                           {
                               "recorded_at":  "2026-07-27T17:37:50.7759063+08:00",
                               "retry_count":  2,
                               "task_id":  "2026-07-26-queue-active-index-optimization",
                               "fail_reason":  "unknown_retry"
                           },
                           {
                               "recorded_at":  "2026-07-29T16:12:16.4312030+08:00",
                               "retry_count":  1,
                               "task_id":  "2026-07-29-hermes-runtime-config-decoupling-build",
                               "fail_reason":  "unknown_retry"
                           }
                       ],
    "resolved_evidence":  [

                          ],
    "impact":  "high",
    "recommendation":  "有多個工單在無明確 fail_reason 的情況下進行重試；建議確保 METRICS_LOG 記錄完整的失敗原因以利後續分析。",
    "change_class":  "implementation_change",
    "josh_approval_status":  "pending",
    "dedupe_key":  "4505e58aa63cef386a583f94b032e65633e93a36429cee79a718f032a6898f86",
    "status":  "open"
}
