{
    "candidate_id":  "LC-20260727-38e2d46b",
    "schema_version":  "1.0.0",
    "created_at":  "2026-07-27T17:30:23+08:00",
    "collector_version":  "1.0.0",
    "governance_version":  "1.3.0",
    "governance_hash":  "0EAECF6D153925AC17B940992CC12CE82A6DE5E7F1D7B766BAB9C479C3088EB1",
    "source_task_ids":  [
                            "2026-07-26-ci-smoke-stage-split",
                            "2026-07-26-queue-active-index-optimization"
                        ],
    "source_evidence_paths":  [
                                  "E:\\AgentOS\\data\\escalations\\2026-07-26-ci-smoke-stage-split\\RESOLUTION.json",
                                  "E:\\AgentOS\\data\\escalations\\2026-07-26-queue-active-index-optimization\\RESOLUTION.json"
                              ],
    "failure_reason_key":  "agent_timeout_codex_plan_after_2x600s_bounded_attempts",
    "failure_reason_examples":  [
                                    "agent_timeout_codex_plan_after_2x600s_bounded_attempts"
                                ],
    "frequency":  2,
    "threshold":  2,
    "retry_evidence":  [

                       ],
    "resolved_evidence":  [
                              {
                                  "resolved_at":  "2026-07-27T17:19:48.8286805+08:00",
                                  "task_id":  "2026-07-26-ci-smoke-stage-split",
                                  "resolution_path":  "E:\\AgentOS\\data\\escalations\\2026-07-26-ci-smoke-stage-split\\RESOLUTION.json",
                                  "reason":  "agent_timeout_codex_plan_after_2x600s_bounded_attempts"
                              },
                              {
                                  "resolved_at":  "2026-07-27T17:19:39.3369468+08:00",
                                  "task_id":  "2026-07-26-queue-active-index-optimization",
                                  "resolution_path":  "E:\\AgentOS\\data\\escalations\\2026-07-26-queue-active-index-optimization\\RESOLUTION.json",
                                  "reason":  "agent_timeout_codex_plan_after_2x600s_bounded_attempts"
                              }
                          ],
    "impact":  "low",
    "recommendation":  "分析重複出現的失敗原因（agent_timeout_codex_plan_after_2x600s_bounded_attempts），評估是否需要更新工作流程步驟、驗收條件或相關腳本。",
    "change_class":  "implementation_change",
    "josh_approval_status":  "pending",
    "dedupe_key":  "38e2d46ba77cd40475515e7624d3bfa46dffa61125a562fd82fde6aab1817c32",
    "status":  "open"
}
